,Name,Author,Link,Category,The Specific Category,State,Yuepiao,Description
46,禁区之狐,林海听涛,//book.qidian.com/info/1017653178,体育,足球运动,连载,10865,“胡莱先生，当今足坛像您这样只会进球的前锋生存空间越来越狭窄……但尽管如此，您还是取得了耀眼的成就，请问您的成功秘诀是什么呢？”在一个冬日的午后，胡莱向来自全世界的记者们展示他刚刚获得的至高荣誉，有记者向他提出了这样的问题。面对记者们投来的目光，胡莱的思绪却回到了中学时的那个下午，他孤独的站在球场旁边看其他同学踢比赛，他们不让他上场，觉得他是来捣乱的。他还想到了教练板着脸对他说的话：“胡莱，如果你不能付出十倍于别人的努力，你的天赋就只是毫无价值的石头而已。”以及一个不屑的声音：“现代足球对中锋的要求越来越高，越来越全面，你只会射门有什么用呢？”最后他的思绪定格于那时，夜幕已在东方的天空中若隐若现，在周边长满了荒草的废弃空地中央，有个女孩子很认真地对他说：“胡莱，你其实是有天赋的，而且是很厉害的天赋！因为你知道球门在哪里！”胡莱盯着女孩子的眼睛，从那双眼眸中看到了身后的夕阳。阳光映在瞳孔中，流动着，燃烧着，凝成一道光环，仿佛要把自己也融化在这光芒中一样。收回思绪的胡莱重新回到了这个暖和的冬日午后，面对兴致勃勃的记者们，他微微一笑：“因为我知道，球门就在那里。”
47,复活帝国,火中物,//book.qidian.com/info/1027714068,科幻,星际文明,连载,10854,【简介一】身患绝症选择人体冷冻项目的少年天才任重醒来后，发现自己身处荒山野岭，头上是巨大的蓝色太阳和银白双月。在这陌生的星球，依靠复活回溯时间外挂积累经验的任重，决心成为一名战士。在遭遇了被背叛，被通缉，被审判后他决定反抗这个不公平的世界，用战争建立新世界的秩序。【简介二】把无限的时间压缩为一瞬，任何事都可能发生。在卑微中奋起，行走于时间的缝隙，逆转亿万年的奴役。这是个不死的男人和他的同胞们挣脱命运枷锁的故事。【火中物读者验证群：865641881】
48,半仙,跃千愁,//book.qidian.com/info/1020180183,仙侠,神话修真,连载,10774,深山有道观，香火早凋零。鄙人不才，年方十九，打小就是一名道士，上有师兄十数位，下惟余最小，俗称关门弟子。师门太穷，师兄们难耐清苦，幸掌门师尊豁达，任由众师兄散伙而去。后有三位师兄迷途知返，年纪颇大，皆有四五十。蒙师尊垂青，逝前传掌门之位于小道，然无论年岁或资历皆不能服众，三位师兄不服。师门不幸，小道不是软柿子，绝不退让，与之内讧。山下村中，有新举人，乃小道发小，师尊逝前亦有交代，护送其进京赶考。义不容辞，且容小道人间走一遭，回来再与众师兄斗！QQ书友群：884037273
49,重生之似水流年,苍山月,//book.qidian.com/info/1027551057,都市,都市生活,连载,10571,一个伤痕累累的中年灵魂倒退回时光里，拥抱98年的斑驳阳光。蓦然发现，原来那时少年正好，岁月飘香。原来犯错才叫成长，青春可以如此飞扬...
50,奶爸学园,剑沉黄海,//book.qidian.com/info/1021836787,都市,都市生活,连载,10348,都说女儿是前世的情人，那万一前身是海王怎么办？金牌编剧穿越而来，面对的不是飞黄腾达三宫六院娱乐帝国，而是，满！园！子！的！瓜！娃！子！（日常风，温馨风，轻喜风，有萌娃，已有完本小说《与萌娃的文艺生活》《哥哥万万岁》）
51,九星之主,育,//book.qidian.com/info/1023415526,科幻,进化变异,完本,10204,寒星映戟月照弓，龙雀辚辚雪夜惊。半纸功名千山外，银花火树故乡中。“我，荣陶陶，总有一天，会成为那九颗星辰的主人。”那一年，一个背着小书包、头顶天然卷、手持方天画戟的少年，在天台上如是说道。…已有四百万字完本作品《九星毒奶》，欢迎各位阅读。
52,我真没想当训练家啊,北川南海,//book.qidian.com/info/1021583346,轻小说,衍生同人,完本,10099,现在站在你面前的是——得文公司董事会、彩虹火箭队缔造者、逆属性大师、世界锦标赛冠军……传奇训练家陆野，回忆起首次直播时的场景，喟然长叹。“说起来你们可能不信，我最初的愿望只是破十万订阅露个脸而已。”“我只想恰点钱，从一名游戏区UP主做起。”“我真没想当训练家啊！”本书又名：《青春期训练家不会梦见神奥冠军》、《竹兰大小姐想让我告白》、《成为世界冠军从主播开始》……【融合世界观，平行世界+动画、游戏设定+特别篇】关键词：精灵宝可梦、口袋妖怪、神奇宝贝、宠物小精灵、特别篇
53,神秘复苏,佛前献花,//book.qidian.com/info/1012584111,仙侠,现代修真,连载,9830,“我叫杨间，当你看到这句话的时候我已经死了......”一张诡异的羊皮卷，一只窥视黑暗的眼睛，这是一个活下来的人经历的故事。——————
54,大数据修仙,陈风笑,//book.qidian.com/info/1010737835,仙侠,现代修真,连载,9673,冯君身为985的双学位，毕业就失业了，在都市中艰难打拼，偏偏还放不下架子，他的处境可想而知。直到有一天，他和手机被雷劈了，猛然发现，原来自己可以化身数据，进入app中。化身数据进入app中能做什么？能做的太多了，尽情想像吧……慢着，手机银行的存款？住手，那个不能乱改！当然，这并不仅仅是全部，然后他还发现，自己居然可以自由进入仙侠位面……让我们跟随冯君，踏上奇妙的修仙之旅，“落花时节又逢君”，这话可不是白说的……
55,顶级气运，悄悄修炼千年,任我笑,//book.qidian.com/info/1026562582,仙侠,神话修真,完本,9663,转世来到修仙世界，韩绝发现自己带着游戏属性，竟然可以摇骰子刷新灵根资质与先天气运。于是乎，他花了十一年摇先天气运。【绝世无双：仙姿，魅力顶级】【天命剑痴：剑道资质顶级，剑道悟性顶级】【身法绝尘：身法资质顶级】【仙帝后裔：获得一部绝世修仙功法、一千块上品灵石】韩绝为了长生，决定悄悄修炼，不出风头。千年后，修真界一代换一代。当仙界清理凡间时，韩绝不得不出手。他这才发现，好像仙神也不过如此！……读者群：668385276
56,吕布的人生模拟器,会说话的胡子,//book.qidian.com/info/1028036771,历史,秦汉三国,完本,9487,你相信吗？一个人的人生，从你性格成型的那一刻就已经注定，虽然人生会有很多机遇和很多选择，但当你面对这些机遇和选择的时候，你的性格和认知早已注定了你会如何选择，作为一个注定的失败者，您是否愿意从此刻起重塑您的人生？人生模拟器，改变未来，改变人生，你值得拥有。洛阳城外，吕布跨坐在赤兔马上随着队伍行驶在宽敞的驿道之上，脑海中那如同梦魇般的信息再度涌来，耳畔还有那欠揍的声音不断萦绕，不多，但却反复不断地说，如同夏日的蚊蝇一般在你耳畔不断闪过，还打不死，让吕布烦闷不堪。
57,这不是娱乐,睡觉会变白,//book.qidian.com/info/1028349326,都市,都市生活,完本,9404,毁灭吧，累了！读者群：629116518，66646452
58,长生志异,真愚老人,//book.qidian.com/info/1028121685,仙侠,现代修真,连载,9375,长生天朝，天命九年。神州大乱，民不聊生。皇室统御崩坏，西方夷人携诸神教统来袭。新式军阀四起，割据一方，太平乱党肆虐，生灵涂炭。诸如洪涝大旱，地龙翻身，沙暴龙卷，酸雨红月、陨石坠落等天灾纷纷降临。更有无数妖魔横行、怪异丛生，神鬼混居，不可名状的诡物，亦或是无法理解的神秘现象。在这黑暗乱世中，陶潜睁开双眼，发现自己成了菜市口即将被斩首的囚犯……！ps：已有精品完本小说《秘巫之主》，近现代神秘侧背景，感兴趣的可以试试。
59,这游戏也太真实了,晨星LL,//book.qidian.com/info/1029391348,轻小说,原生幻想,连载,9284,这游戏也太真实了叭！搬砖、跑腿、捡垃圾、送快递……公司最多能让你体会到996的艰辛，在这里你能体会到超级加倍的007。好了，不废话了，伟大的管理者大人喊我去搬砖了。那位大人说了，只要我们努力献上自己的肝，下个月他又能换一套全新的动力甲，到时候带我们开全新的地图，去广阔的废土捡更多的垃圾！……穿越到废土世界的楚光发现，自己解锁了避难所系统，能够从平行世界召唤名为“玩家”的生物。从那天开始，整个废土都不正经了。
60,没钱上大学的我只能去屠龙了,宇宙无敌水哥,//book.qidian.com/info/1021624434,轻小说,衍生同人,连载,9129,总之岁月漫长，然而值得等待。林年等了十六年，等到了卡塞尔之门的召唤，等来荒诞无稽、热血放纵的青春。
61,我的1978小农庄,名窑,//book.qidian.com/info/1023160930,都市,都市生活,完本,8487,远离城市喧嚣的小山村开起了一个小农庄这里有七八年十多块一瓶的茅台，有七八块的五粮液有机菜，有机鱼虾，有机煮羊肉，绿色环保味道好。本是中年离异失败男，转身成了悠闲农庄主。山村小农庄，名声远播。拖鞋汗衫芭蕉扇，晃晃悠悠一整天。&amp;ldquo;订餐，没的问题，排队&amp;rdquo;一天一桌看心情，优哉游哉小日子。李栋摸摸挂在胸口小物件，充满能量了，该去1978年进货了，一个2018年的中年男子，穿越四十年带货的故事
62,我真的只是想打铁,静悄悄地写,//book.qidian.com/info/1018126660,体育,篮球运动,完本,8290,90年代，正当大卫-斯特恩一脸焦虑地站在大天朝电视台门外，看着自己手中的NBA录像带，寻思着怎么来打开潜力无穷的中国市场时，他万万没想到.......原来向上帝许愿，还真TM有用！“铁影”、“北方神”、“NBA篮框之笑容保护者”、“不是后仰从不投”、“一手跳投美如画”......当拥有以上绰号的苏枫横空出世，未来许多人的青春，在这一刻开始了！“啊呸！这帮黑粉到底有完没完！劳资的绰号明明是‘弑神者’！”看着报纸，苏枫愤愤不平地说道。弑是弑神的弑，者是弑神者的者，至于神？90年代的NBA，能有几位神？普通群群号：484028022VIP全订群：老书全订读者在普通群私聊管理
63,我玩游戏能提取奖励,酉卒日天,//book.qidian.com/info/1028223866,游戏,游戏异界,完本,8271,重生异变的世界，我驱使了数据化的身躯走上了巅峰之路。别人在修炼提升实力……我在打游戏！别人在基因改造提升实力……我还在打游戏！别人在嫁接武魂提升实力……我依旧打游戏！不管你信不信，我玩玩游戏就能抵得上你所有的辛苦努力！然后也不要试图和我比后台，我的岳父是全球首富！（目前书籍前期内容已根据这些设定全部做了修改，所以请新书友勿看盗版。）
64,诡秘之主,爱潜水的乌贼,//book.qidian.com/info/1010868264,玄幻,异世大陆,完本,8220,蒸汽与机械的浪潮中，谁能触及非凡？历史和黑暗的迷雾里，又是谁在耳语？我从诡秘中醒来，睁眼看见这个世界：枪械，大炮，巨舰，飞空艇，差分机；魔药，占卜，诅咒，倒吊人，封印物……光明依旧照耀，神秘从未远离，这是一段“愚者”的传说。
65,我只想自力更生,中秋月明,//book.qidian.com/info/1021517869,都市,青春校园,完本,7968,赵德柱重生了。他不知道炒国库券，不知道炒股票，不记得中奖彩票号，也不懂怎么做生意赚钱……他只有一个念头：我要自力更生！书友新群:1083657061，欢迎吹水V群1158160683不喜欢追更的，可以先看完本美术职业文《大美时代》、佣兵枪战文《我是个么得感情的杀手》
66,艾泽拉斯阴影轨迹,帅犬弗兰克,//book.qidian.com/info/1028005898,游戏,游戏异界,连载,7626,骨灰级玩家穿越魔兽，成了吉安娜的亲哥哥，咱现在也是王子了，为了家族存续着想，我是不是该先把自家妹妹的腿打折，免得她以后成为一个弑亲禽兽？等等？怎么一过来就要先死一次？让我看看攻略。嗯，先触摸额头开启人物面板，然后抄起武器去开了那个兽人的脑壳，如果掉落装备就赚了，没有也不必伤心，洗把手，然后再去找下一个……好了，不开玩笑了，让我们正经一点，重新开始讲这个故事：死亡是一把钥匙，打开新的人生。布莱克.肖手握玩家模板，可以打怪升级，坐拥职业系统，一路高歌猛进。系紧黑夜为披风，手握阴影做利刃，用杀戮磨砺爪牙，以恐惧喂养野心。从风暴王国到奥格瑞玛，他的恶行无人不知，从冰冠冰川到潘达利亚，他的恶名无人不晓。当黑衣帝王破影而出时，整个世界都战栗不休。这就是关于这个人的故事，从黑暗之门六年的卡兹莫丹讲起...
67,打篮球太厉害了怎么办,超级麦克风,//book.qidian.com/info/1024861112,体育,篮球运动,完本,7484,“你为什么打篮球？”“其实我的目标是成为一名教练，但我好像没有当教练的天赋，只能选择打NBA。”“有人说你是软蛋内线，只会飘在外线投篮。”“哪个输给我的家伙说的？一听就是个胖子，告诉他，没我他永远拿不到冠军。”“你当初为什么跳过大学直接进入NBA？”“但凡美国有一个大学愿意给我全额篮球奖学金，我也不会那么快成为史上最强投手。”……简介无力，就这样吧，一个90年代中期开始的篮球故事。
68,什么叫游走型中单啊,这很科学啊,//book.qidian.com/info/1021580892,游戏,电子竞技,完本,7451,"{英雄联盟电竞文}3包1,4包2，各种游走支援都是林燃拿手绝活而且他极其擅长打钱发育，能把野怪当自己的兵线刷，搞的自家蒜头王八苦不堪言。S6出道的林燃努力打碎破晓前的黑暗，和队友一起为LPL撑起名为希望的光。群号：1103852302，答案为书名（不加书名号）"
69,我有一个武道世界,俺来组成头部,//book.qidian.com/info/1027239049,诸天无限,诸天,完本,7346,平凡的蓝星出现一个超人会怎样？双穿门，唯一超凡。小目标——硬抗核弹~
70,御道倾天,风凌天下,//book.qidian.com/info/1016460852,玄幻,高武世界,完本,7189,是非谁来判定，功过谁予置评？此生不想规矩，只求随心所欲。天机握在手中，看我飞扬跋扈。————我是左小多，我不走寻常路。VIP全订阅群号：971103262
71,我在斩妖司除魔三十年,贰更,//book.qidian.com/info/1025377681,仙侠,古典仙侠,连载,6823,一觉醒来，周易成了大乾斩妖司的行刑官。恰逢妖魔乱世，鬼怪横行，乾坤剧变。周易躲在斩妖司，每天行刑妖魔获得各种奖励。黄庭道经、紫郢仙剑、蟠桃灵根、五色神牛、天罡法术、地煞神通……九天十地，漫漫仙道，吾当掌教尊！
72,小阁老,三戒大师,//book.qidian.com/info/1016855477,历史,两宋元明,完本,6822,站在你面前的是：大明王朝的守护者，万历皇帝的亲密战友，内阁首辅的好儿子，十六、十七世纪全球首富。控制吏部三十年的幕后黑手，宗藩制度的掘墓人，东林党口中的严世藩第二，张居正高呼不可战胜。海瑞的知己，徐渭的东家，利玛窦的剃度人，徐光启等六位状元的授业恩师。大明诗坛遮羞布，七百余种各学科书籍撰写者，两千七百余项专利的发明人，现代大学与科学的奠基者。海外汉人的保护神，新航路的开辟者，大洋秩序的维持者，全球大型工程的承包商。祸乱欧洲的罪魁祸首，德川家康的义父，塞巴斯蒂安的拯救者，一心为民的小阁老。小阁老书友群：56471661
73,大魏读书人,七月未时,//book.qidian.com/info/1029160231,仙侠,古典仙侠,完本,6711,武昌元年。大魏王朝，历经七次北伐而败，国库空虚，民不聊生，又逢先帝驾崩。而后，女帝登基，日月当空。此时，天下妖魔横出，为祸人间。大魏藩王蠢蠢欲动，朝堂涌动不安，异族番邦虎视眈眈。也就在大魏江山岌岌可危之时，文科生许清宵穿越而来，却发现只剩下十二时辰寿命。为求自保，修行‘异术’，凝聚魔种，获取超凡力量！为压制魔种，许清宵修行最强体系儒道，却不曾想，借助诗词文章，一步一步证道文圣。“吾乃许清宵，大魏读书人。”“读的是春秋！”————【万订热血儒道之作】【无敌穿越智斗爽文】【八十三章炸裂起飞】【日更两万稳定作品】
74,我绑架了时间线,一刀斩斩斩,//book.qidian.com/info/1027606717,科幻,时空穿梭,连载,6641,每一次改写现实，都会让未来发生变化。亲眼目睹人类文明在1500年后灭亡，意外获得穿越未来能力的封棋选择了不断重启时间线，通过情报为人类文明博取一线生机。
75,这个前锋不正经,肉末大茄子,//book.qidian.com/info/1028605578,体育,篮球运动,连载,6628,奥斯汀孤僻内向的少年，最终成了联盟叱咤风云的MVP，付出的是常人无法想象的汗水和努力。这一路走来，他所站过的地板都被汗水所浸湿，它们也是这段历史的见证者。林影，来自2021年的一个数据分析师，穿越到了2005年，却猛的发现自己竟然没有系统！若干年后，球迷：“你的林皇，无限猖狂！”“联盟只有一个皇，那一定是我林皇！”ps：首订精品，欢迎入坑。
76,徒弟太勤奋显得师父有点懒,天狗吃月亮,//book.qidian.com/info/1028580711,玄幻,东方玄幻,完本,6542,李虚收了个女徒弟，饿了徒弟会喂饭，累了徒弟能捏肩，睡觉徒弟帮宽衣。真不是他懒，是徒弟太勤奋显得他有点懒。
77,在下壶中仙,海底漫步者,//book.qidian.com/info/1025745191,都市,都市异能,完本,6468,炼妖壶可以炼化妖物，还自带一个空间“壶中天地”。这看起来还是很不错的，可惜……找了两年，现实世界中没有妖怪，想炼妖没得原材料；壶中天地中被困在一隅，周围全是打不过的树精，寸步难行。找不到修仙功法，没有灵丹妙药，都市修仙爽文之旅胎死腹中，娶九个老婆胜过唐伯虎鄙视韦爵爷的梦想直接幻灭，只能改了校园奋斗+恋爱爽文剧情，但……妖怪来了！
78,贫僧不想当影帝,陶安逸,//book.qidian.com/info/1024130107,都市,娱乐明星,完本,6432,【一句话简介】这是一个少年武僧被孪生兄弟坑进演艺圈、结果一不小心成了影帝的故事。【正经简介】许臻是个在寺庙长大的孤儿。老主持一手将他拉扯大，二人不是父子却胜似父子。许臻本想二十岁后正式入戒，为师父养老送终。结果，十八岁那年，一个自称是他哥哥的人却联系到了他。说母亲去世了，问他要不要来祭拜。许臻思量良久，最终还是听从了师父的建议。是青灯古佛还是红尘俗世，且下山去看看再做决定。然而。山下等待他的却是……身为十八线艺人的孪生哥哥把他扔在家里当替身，自己跑！路！了！“小师父，你就帮我这一次吧。”哥哥的经纪人看着一脸懵比的许臻，欲哭无泪地道：“我搭着人情、搭着面子，死皮赖脸才求来的这部戏。”“结果现在临阵开天窗，我以后还怎么做人？”“求你了，帮帮我，演好演坏都无所谓！”许臻看着面前红彤彤的5万块钱，犹豫了。他想起了西南角漏雨的斋堂，以及颤颤巍巍的藏经阁，默默算了算帐。“小僧一心向佛，未得禅心，怎能轻易涉足红尘之事……”许臻一脸严肃地道：“得加钱。”
79,玄浑道章,误道者,//book.qidian.com/info/1015358161,仙侠,修真文明,连载,6357,在这个神怪遍地的世界经历了第六个纪元之后，煌煌天夏降临了！…………玄浑道章书友群：【762873632】玄浑道章•造化之界：【526275426】玄浑道章VIP书友群：【615387042】…………
80,旧日之箓,熊狼狗,//book.qidian.com/info/1023715291,玄幻,东方玄幻,连载,6344,本以为自己是穿越到了古代，楚齐光正想着怎么发家致富……却突然发现隔壁县发生了尸变案，观里的道士正在降妖除魔，就连村里的野猫都开口说话了。正想着要不要开始斩妖除魔，却发现自己不知不觉间正成为最恐怖的大妖。
81,莫求仙缘,蒙面怪客,//book.qidian.com/info/1025282227,仙侠,幻想修仙,完本,6313,仙是求不来的莫求这个名字，就是由此而来。
82,平常人类的平凡生活,何处可桃,//book.qidian.com/info/1023473373,都市,都市生活,连载,6307,这书有毒，晚上不能看，上班不能看，吃饭不能看，走路不能看，只能自己偷偷看。………………………………何四海，人称何大力，擅长种田、搬砖、吹牛、摆摊、攒钱、养桃子。这只是一个“普通人类”的“平凡”生活故事。这是一个帮助亡者完成心愿，引渡灵魂的故事。让我们一起寻找平凡中的感动。本书又名《接引人的平凡生活》、《黄泉引路人》、《心愿摆渡人》、《还愿接引人》。欢迎加Q群，也可以分享你的故事：59139642
83,黄金召唤师,醉虎,//book.qidian.com/info/1024640042,玄幻,东方玄幻,连载,6169,这是一个由召唤师们主导的世界，在这个世界，召唤师是中央舞台上最耀目的主角。当那神秘莫测的更高的世界变得触手可及之时，当中华文明的荣耀与记忆照进现实之时，降临大炎帝国的召唤师的精彩故事，就此开始……
84,末日拼图游戏,更从心,//book.qidian.com/info/1023812355,游戏,游戏异界,完本,6163,你一觉醒来，发现自己来到了高塔末世，人类住进高塔，塔外都是怪物。而你的眼睛里能够看到奇怪的备注：【一千六百米外藏着两只恶堕，你在极端愤怒时一记滑铲，能把它们喂的饱饱的。】【在你想着蒸煮油炸之前，最好摸摸它的左侧口袋，千万不要养成杀怪不舔包的恶习。】【居然会有人盯着自己的脸看，我承认你的脸很有带入感，假如我是人类的话，我可以给你打9分，当然了，我97分。】【对方是一个等级比你高出太多的大佬，我给你三个建议，跪舔，跪舔，或者跪舔。弱点？不应当，我只是一个能力有限的小备注。】象征末世明珠的高塔，被恶念吸引的塔外畸变怪物，上位者的赌局，探索者的险境，末日中的陷阱，在你的双眼下，都以调皮的风格呈现。【书友群：495046479（火爆新服，刚开一秒）】
85,全民魔女1994,宇宙鸽,//book.qidian.com/info/1014892472,科幻,进化变异,完本,6104,一觉醒来，世界大变样。从正常人类世界线的2013年，回到了全民魔女世界线的1994年。“也许世界上根本没有魔女，又或是人人都是魔女。”
86,信息全知者,魔性沧月,//book.qidian.com/info/1019222135,都市,异术超能,完本,6044,所见能知道一切已发生之事，所闻能看穿世人诡谲人心，所感能知晓他人隐藏在记忆深处的秘密。知道的越多，越不幸福，仰望星空，黄极感受着来自整个宇宙的恶意，以及人类的绝境。仅仅只是地球乡村小农民的他，不得不感慨：“我知道的太多了。”无论是科技还是神话，亦或者宇宙隐藏的bug……皆逃不过信息的感知。面对人类被高等文明圈养而不自知的无解困局，黄极只能跟外星人比一比，谁知道的更多了！
87,柯南里的捡尸人,仙舟,//book.qidian.com/info/1025089307,轻小说,衍生同人,连载,6028,《伪·犯罪策划书的酒厂生涯》、《如何正确蹭到死神光环》——————江夏吸了一口假烟，忧愁地吐出烟圈：“我只想蹭点案子捡捡尸，没想到把自己蹭成了反派眼中的‘犯罪策划师’。”“什么？主角为什么不抓我？”“……可能是因为在他们眼里，我是当代的高中生版福尔摩斯。”——————对主角的采访：Q1：请问您成为黑衣组织【王牌鲨手】的秘诀是？江夏：“带上柯南去目标家里转一圈。”.Q2：为何您身边，总有“死而复生”的死者出没？江夏举起了小喇叭：“高价回收报废人才，五险一金，包吃包住。”——————对柯学世界侦探们的采访：Q1：如何看待江夏。侦探们：“除了破案太快，没有其他缺点。”.Q2：同为高中生侦探，为什么不联合江夏一起对抗黑衣组织？侦探们（匆忙摆手）：“不不不，不能告诉他，这些世界的暗面对他来说实在太沉重了。”———————【起点中文网，名侦探柯南同人】有部分金田一案件
