,Name,Author,Link,Category,The Specific Category,State,Yuepiao,Description
88,最初进化,卷土,//book.qidian.com/info/1017021237,玄幻,东方玄幻,连载,5896,本书QQ交流群：153340812最意外的诡异宿命，最激烈的脑力碰撞，最残酷的生死战斗，最疯狂的奇异幻想，最离奇的事实真相......最初已至，再战十年！
89,视死如归魏君子,平层,//book.qidian.com/info/1027440366,轻小说,原生幻想,连载,5796,魏君确认自己被杀死后就能直接无敌，于是他开始疯狂的作死。然后，他发现这个世界有毒。“当初仙门凌驾于朝堂之上作威作福，满朝文武包括朕皆对仙人卑躬屈膝，只有魏君一身是胆，视死如归，在众目睽睽之下大骂朕有辱帝王尊严，更是直言仙人不死，大盗不止。当时朕就下定决心，如此忠臣，朕一定要护他周全。”“仙人说我是天煞孤星，所到之处死亡如影随形。我秉公执法，却被嫌弃给人带来了噩运。我无私的帮过很多人，我落难的时候却只得到了千夫所指。直到魏君的出现，他对我说，我没有错，他不怕死。纵然我的生命只剩黑暗，他也愿用性命舍命燃灯照耀在我身上，让我重见光明。如此大恩大德，小女子无以为报，只能以身相许，魏郎请务必不要推辞。”“我初见魏君的时候，魏君还很弱小，而我是被上界追杀的盖世魔君。我告诉他，救了我就等于和众神为敌，会死的。魏君笑着对我说，死则死耳，何惧之有？我一生纵横无敌，看透了凡间的残酷与仙神的虚伪。直到遇见魏君，我方知这世间当真有视死如归的真英雄。”魏君：“我只是想死，怎么就这么难呢？”
90,全球进入大洪水时代,死神钓者,//book.qidian.com/info/1025750236,科幻,进化变异,完本,5791,新书《地球上最后一幢楼》已经发书——————交流群一：255400347交流群二：494238383地球突然被来历不明的海啸包围，强而有力的洪水，使高山在波涛中颤抖，陆地在巨变中呻吟……洪水以雷霆万钧之势，咆哮着冲向陆地，吞没了城市谷地，以及地球上的所有生灵。
91,弃宇宙,鹅是老五,//book.qidian.com/info/1025677149,仙侠,幻想修仙,连载,5770,地球元气复苏了，但这真不是地球灵气复苏的故事，而是一个流浪宇宙的故事。
92,演武令,鱼儿小小,//book.qidian.com/info/1027441448,历史,架空历史,完本,5744,宣统二年，精武门创立。面对列强入侵，清帮横行。杨林只手遮天，拳镇山河……从纨绔子弟到帝王杀手，诸天演武，问天下，谁是英雄？
93,怪物被杀就会死,阴天神隐,//book.qidian.com/info/1016073648,轻小说,原生幻想,完本,5726,新书《高天之上》已发布，大家可以去看看。=========——异于常人者，即为怪物——天生就是超能者，所到之处百鬼退避，捏碎骨头就和捏碎奶油饼干一样没有区别。太过特殊，其实不是什么好事，为了在这看似平凡的世界中寻找同类，苏昼十年来一路奔波寻觅，却都一无所获……直到灵气复苏突然的到来，为他拉开了一个广袤浩瀚的时代大幕。期待改变，期待超凡，苏昼并不希望看着这个世界燃烧，但他渴望世界变得热闹起来。千里独行，诸界漫步。路见不平，拔刀相助。即便在这充斥着怪物，邪魔与无数妖魔鬼怪的世界中，在这濒临破碎，处于毁灭前夕的多元宇宙内，也无需退缩恐惧，无需迷茫困惑，仍要怀着一颗渴求正义，追求正确的心。毕竟，正如同那人尽皆知的废话，‘人被杀，就会死’一样。怪物被杀，也会死。普群：429408755，无要求PS：已有460w字完本精品小说《燃钢之魂》，可收藏。
94,剑卒过河,惰堕,//book.qidian.com/info/1021693079,仙侠,古典仙侠,完本,5723,小人物，也有大成就！一卒过河，有进无退！一剑在手，再铸辉煌！本书vip群号：964227244。官方群号：853336118
95,我就是神！,历史里吹吹风,//book.qidian.com/info/1029247985,玄幻,异世大陆,连载,5683,五亿年前。寒武纪。尹神降临在最远古的蛮荒大地和原始海洋之上，他是一切的开端，他创造了智慧和生命，他是众生的造物主。时间的流逝里，故事化为史诗，史诗化为神话，最终神话也被埋葬在岁月之中。唯神永恒。
96,当青春幻想具现后,转角吻猪,//book.qidian.com/info/1028881012,都市,都市生活,完本,5570,当时间停止一小时，只有你可以自由移动时，你会做什么？谢邀，这问题别问我啊！你问她——对！就是这个趁着时间停止来到我身边，朝我伸出手的女孩！------时间停止、返老还童、时空电话、猫的报恩……当青春里出现一件又一件荒唐而又神奇的事件时，我们的故事开始了。（关键词：幻想具现、日常、恋爱）
97,妖女哪里逃,开荒,//book.qidian.com/info/1024211211,仙侠,古典仙侠,完本,5509,李轩穿越之后，是抱着窃喜的心情，成为诚意伯府的次子，以及一位光荣的六道伏魔人的。可他的官二代生涯才不过十天，就有暴力的女上司，超凶的女鬼，恶毒的妖女接踵而来。置身漩涡中的李轩表示他一点都不慌，数年之后，他立于长江之上，一刀挥下，霎时封冻千里山河。然后他躺在女上司的怀里，吃着女鬼递过来的葡萄，心安理得的吃着妖女的软饭。
98,我只想安静的做个苟道中人,爆炸小拿铁,//book.qidian.com/info/1026694115,仙侠,幻想修仙,连载,5494,“叮咚！”“欢迎使用全智能修真系统！”“您选择修炼【锻骨决】，系统开始为您修炼，系统检测缺少修炼丹药淬骨丹，请稍等……”“系统成功为你偷取了十颗淬骨丹，修炼继续……”“重要提示，系统修炼期间，您将失去身体的控制权……”得到智能修仙系统后，裴凌不声不响的飞速成长，准备一直苟到成仙，直到某一天……“叮咚！”“您选择修炼【无名功法】，系统检测缺少道侣，系统正在为您寻找道侣……”于是，裴凌眼睁睁的看着自己跑向隔壁仙子的修炼室……
99,从木叶开始逃亡,叶惜宁,//book.qidian.com/info/1024843795,轻小说,衍生同人,连载,5473,凡事总须研究，才会明白含义。穿越者千叶白石拿起了一本名为《火的意志》的书籍。扳开一看，上面的东西毫无营养，木叶村的历史也没有年代，只是歪歪斜斜的每一页上都写着‘火之意志’几个字。白石横竖睡不着，又把《火的意志》这本书拿出来，仔细看了半夜，才从字缝里看出字来，满本都写着两个字——传销！白石心里一阵彷徨与恐惧，他决定，迟早有一天一定要逃出这个名为木叶的传销洗脑组织！（PS：动漫，同人，火影，慢热，不无脑，伪无敌）（PS：群号——836175260，进群答案——宇智波琉璃）
100,天天中奖,云罱,//book.qidian.com/info/1027334219,都市,都市生活,连载,5457,江帆重生了，眼睛发生了一些变化，能看到未来的一些东西。书友群：719426752（已满）2群：939359404
